Vendesi VIlla di prestigio	Aurelio/ Boccea	1.600.000 €	http://www.kijiji.it/annunci/vendita/roma-annunci-aurelio-boccea/villa-unifamiliare-di-prestigio/41727672	Villa unifamiliare di prestigio,
ADATTA a: feste private, cene, eventi, cerimonie, catering,
bed & breakfast, casa di cura,
attività turistico-alberghiere, etc., etc.,.

Ottimo stato di conservazione, costruita con regolare licenza del Comune di Roma nel 1977. La proprietà si estende per 11.000 metri quadri. Abbiamo 100 piante di ulivo con cui produciamo olio
di oliva extravergine per 300 litri di olio l'anno. L'atra parte del terreno è adibita
a parco, con alberi di alto fusto ed...